From,Subject,Body,X-FileName,IsPhishingNational City <clientservice.ref27143328.cm@nationalcity.com>,National City: notification!,None,None,1
National City <corporateclients.refbh944375302j.cm@nationalcity.com>,alert - online form released! (message id: n141059832732nd),None,None,1
National City <service.refj537654068381l.cm@nationalcity.com>,National City Reminder: Please Update Your Data! (message id: yr9466892af),None,None,1
Regions bank <clientdepmnt.refnn5821236zf.cm@regions.com>,notice: confirm your online banking records! (message id: n71651265425nc),None,None,1
National City <corporateservice.ref670448286.cm@nationalcity.com>,urgent security notification for client of the National City! (mess_id: M130192410422),None,None,1
National City <clientcare.refao85544387.cm@nationalcity.com>,National City corporate customer cervice corporate customer cervice: please confirm your online banking records!,None,None,1
Regions Bank <customerservice.refz84458091.cm@regions.com>,Confirm Your Account Records!,None,None,1
National City <corporateclients.refIG610816652C.cm@nationalcity.com>,National City corporate customer cervice: security issues!,None,None,1
National City <clientcare.refyg8192818m.cm@nationalcity.com>,National City: Confirm Your Account Records! (mess_id: iv69315386752),None,None,1
National City <cservice.ref9481820.cm@nationalcity.com>,E-Banking Account Confirmation! (message id: 476050086353057),None,None,1
Regions bank <clientdepmnt.refU83713170339ZC.cm@regions.com>,Regions Bank: alert - online client form released! (message id: qq9421460),None,None,1
National City <clientservice.refp72961406j.cm@nationalcity.com>,National City corporate customer cervice: important message!,None,None,1
BB&T <clientdepmnt.refjv0027914116.cm@bbt.com>,Important Message For BB&T Client! (message id: c37643388cw),None,None,1
BB&T Customer Service <clientservice.refR174270907910HI.cm@bbt.com>,Customer Notice: Details Confirmation! (message id: LH38947335383),None,None,1
BB&T Customer Service <businessservice.refe45533583i.cm@bbt.com>,BB&T: important information! (message id: 48204011193152),None,None,1
National City <clientdepmnt.ref8428420914118.cm@nationalcity.com>,We Need To Update Your Information!,None,None,1
National City <clientservice.refN9797928470M.cm@nationalcity.com>,National City corporate customer cervice: please read this message! (message id: RZ235897446339PO),None,None,1
Regions Bank <corporateclients.reft3457472792sn.cm@regions.com>,Regions Bank corporate customer cervice: data confirmation!,None,None,1
National City <customerservice.refoh3008258s.cm@nationalcity.com>,Customer notification: data confirmation!,None,None,1
Regions Bank <corporateservice.refo524856580.cm@regions.com>,Regions Bank: important notice!,None,None,1
National City <service.refnn68057816.cm@nationalcity.com>,National City Reminder: Banking Mail From National City! (message id: ef440939287119yv),None,None,1
Regions bank <service.refq440127680315.cm@regions.com>,Your account!,None,None,1
Regions Bank <clientdepmnt.refs02473387do.cm@regions.com>,Regions Bank corporate customer cervice: service message!,None,None,1
National City <corporateclients.refEJ6682272.cm@nationalcity.com>,National City: please confirm your details! (mess_id: K0580450162727),None,None,1
National City <cservice.refg923897342.cm@nationalcity.com>,important information for National City clients! (message id: R6108053890EX),None,None,1
Regions Bank <cservice.refnj4122335595o.cm@regions.com>,please update your details! (message id: 12970753),None,None,1
National City <corporateclients.refKX8606687.cm@nationalcity.com>,National City: important message! (mess_id: g80306304679385),None,None,1
National City <clientservice.refoy735870045.cm@nationalcity.com>,Urgent security notification!,None,None,1
Regions Bank <clientcare.ref9740504.cm@regions.com>,Regions Bank corporate customer cervice: official update! (mess_id: PX71681775FV),None,None,1
"""update@amazon.com"" <accounts@amazon.com>",Please Update Your Amazon Account !,None,None,1
National City <clientdepmnt.refk3052331403059.cm@nationalcity.com>,National City reminder: online form!,None,None,1
Regions Bank <custservice.refB506261016.cm@regions.com>,important notification from Regions Bank! (message id: YS3446364872RN),None,None,1
National City <custservice.refqq057246473175a.cm@nationalcity.com>,important account notice! (message id: v945103226c),None,None,1
Regions bank <customerservice.refMZ33393225704Q.cm@regions.com>,Official update!,None,None,1
National City <clientservice.refng0651422363es.cm@nationalcity.com>,National City reminder: confirm your account details!,None,None,1
Regions Bank <custservice.refc22030789639.cm@regions.com>,Regions Bank Reminder: Confirm Your Regions Bank Client Details! (message id: sn56944086030ev),None,None,1
National City <clientservice.refRZ8379534997WW.cm@nationalcity.com>,National City corporate customer cervice informs you! (mess_id: y32348099wj),None,None,1
Regions bank <customerservice.refgn5772505204987.cm@regions.com>,Regions Bank Corporate Customer Service: Important Message!,None,None,1
The Regions US Interact 2007 <technical_support-op-968ljs@regions.com>,Regions Bank USA Internet Cash Management Customer Message: Instructions For Client,"{'2007': 1, 'apologize': 1, 'arranged': 1, 'bank': 2, 'banking': 2, 'caused': 1, 'cfm': 1, 'client': 2, 'cmserver': 1, 'collaboration': 1, 'com': 1, 'commercial': 1, 'copyright': 1, 'corp': 2, 'corporate': 2, 'customer': 1, 'dear': 1, 'details': 1, 'directions': 1, 'does': 1, 'financial': 2, 'followed': 1, 'grateful': 1, 'http': 1, 'ibsregions': 1, 'ignore': 1, 'image': 1, 'interact': 2, 'launch': 1, 'link': 1, 'mailed': 1, 'management': 1, 'members': 1, 'notice': 1, 'performing': 1, 'problems': 1, 'procedure': 1, 'regions': 6, 'reserved': 1, 'rights': 1, 'service': 1, 'services': 1, 'subdivision': 1, 'support': 1, 'treasury': 2, 'update': 1, 'upgrade': 1, 'usa': 3, 'verification': 1, 'verify': 1, 'visiting': 1, 'www14xhed': 1}",None,1
Washington Mutual <clientcare.refce90776951y.cm@wamu.com>,Important Information! (message id: t99370347824384),None,None,1
National City <corporateclients.ref851724595710529.cm@nationalcity.com>,National City corporate customer cervice: secure details confirmation! (message id: Q459666257L),None,None,1
Washington Mutual <clientdepmnt.refv3666840j.cm@wamu.com>,WAMU corporate customer cervice corporate customer cervice: confirm your online banking records! (message id: nd6191677451iz),None,None,1
Regions bank <corporateservice.refa76095964132903.cm@regions.com>,important notice! (message id: C377735272935),None,None,1
Washington Mutual <service.refMA80851508.cm@wamu.com>,Washington Mutual: Important Announce! (mess_id: 289102510),None,None,1
National City <corporateservice.reflm834970104335m.cm@nationalcity.com>,Urgent Security Notification For Clients! (mess_id: rm87983357599851),None,None,1
Regions Bank <custservice.refM372482205.cm@regions.com>,Regions Bank corporate customer cervice: important account notification! (message id: AK220847172ES),None,None,1
National City <custservice.refht3410595.cm@nationalcity.com>,Important Message For National City Client!,None,None,1
"""U.S. Bank"" <service.refk7724472074b.ub@usbank.com>",U.S. Bank corporate customer cervice: important banking mail!,None,None,1
Regions Bank <corporateclients.refi2777647.cm@regions.com>,Regions Bank corporate customer service: important announce! (mess_id: l5410650),None,None,1
National City <corporateservice.refH454589470.cm@nationalcity.com>,National City reminder: notification!,None,None,1
"""U.S. Bank"" <clientcare.refow6133835iz.ub@usbank.com>",U.S. Bank Corporate Customer Service: Online Form Released! (mess_id: t14068903211ae),None,None,1
"""U.S. Bank"" <corporateservice.reff37052112068vx.ub@usbank.com>",U.S. Bank Corporate Customer Service: Online Banking Form! (message id: r553744002556a),None,None,1
Regions Bank <clientcare.refUZ2422617435.cm@regions.com>,Regions Bank: security issues!,None,None,1
National City <corporateservice.refAZ18498308140708.cm@nationalcity.com>,National City Corporate Customer Service: Data Confirmation! (message id: w5220379324k),None,None,1
"""U.S. Bank"" <clientcare.refZ7725066661.ub@usbank.com>",U.S. Bank corporate customer service: account secure confirmation!,None,None,1
"""U.S. Bank"" <cservice.reft6214034460s.ub@usbank.com>",U.S. Bank Corporate Customer Service: Confirm Your Account Details! (message id: pz7721953431826),None,None,1
Regions Bank <clientservice.refL7896456013UR.cm@regions.com>,notice: confirm your online banking records!,None,None,1
Washington Mutual <custservice.refRG4190492VY.cm@wamu.com>,WaMu corporate customer service: confirm your online account details! (mess_id: n6151477307xb),None,None,1
National City <corporateclients.refx328051458485x.cm@nationalcity.com>,National City corporate customer service: confirm your information! (message id: 88086203886276),None,None,1
Regions bank <corporateclients.refuc03653454.cm@regions.com>,Regions Bank corporate customer service: urgent security notification! (message id: 336624194676537),None,None,1
Regions bank <corporateclients.refuc03653454.cm@regions.com>,Regions Bank corporate customer service: urgent security notification! (message id: 336624194676537),None,None,1
Regions Bank <customerservice.refWA238905616.cm@regions.com>,Regions Bank: please update your data! (message id: o2749979716172),None,None,1
Regions bank <cservice.refmk920587603988ou.cm@regions.com>,Regions Bank corporate customer service: data confirmation! (mess_id: pb23408493022),None,None,1
National City <corporateclients.refrw246599688nt.cm@nationalcity.com>,important notice! (mess_id: mt43315094z),None,None,1
National City <corporateservice.ref781429393083390.cm@nationalcity.com>,National City corporate customer service: confirm your online account access! (message id: 501242313483600),None,None,1
Regions Bank <clientcare.refh38550488b.cm@regions.com>,cofirm your details with Regions Bank!,None,None,1
PNC Bank <clientcare.refkc94389252351to.ib@pnc.com>,Urgent security notification for client of the PNC Bank!,None,None,1
National City <clientdepmnt.refed087904965938d.cm@nationalcity.com>,confirm your online account details! (mess_id: 106042395346),None,None,1
PNC Bank <custservice.refJ66331856.ib@pnc.com>,PNC Bank: customer details confirmation! (message id: wb529596120kq),None,None,1
Regions bank <customerservice.refGG538682597ST.cm@regions.com>,Regions Bank corporate customer service: e-banking account confirmation! (mess_id: s8240334720659),None,None,1
Regions bank <customerservice.refs0011660990.cm@regions.com>,please confirm your data! (message id: hr443148927512ue),None,None,1
PNC Bank <service.refqn216754894143.ib@pnc.com>,Urgent security notification for client!,None,None,1
National City <cservice.refI409595265882.cm@nationalcity.com>,National City corporate customer service: security alert!,None,None,1
Regions bank <clientdepmnt.refn78330889078hu.cm@regions.com>,Your Account With Regions Bank!,None,None,1
PNC Bank <cservice.refrq69637830j.ib@pnc.com>,Customer notification: details confirmation! (message id: ny208135124),None,None,1
National City <custservice.refyk2702002iq.cm@nationalcity.com>,National City: confirm your online account details! (message id: d4176915921),None,None,1
Regions Bank <clientservice.refX26747293033.cm@regions.com>,Regions Bank Corporate Customer Service: Please Confirm Your Data! (message id: MP58801735367),None,None,1
PNC Bank <clientcare.refGF2791125.ib@pnc.com>,Notification!,None,None,1
National City <corporateservice.ref4408534262555.cm@nationalcity.com>,National City reminder: confirm your details!,None,None,1
PNC Bank <clientcare.refL737740875242J.ib@pnc.com>,instructions for client!,None,None,1
National City <service.refL90469031.cm@nationalcity.com>,National City Corporate Customer Service: Service Message! (mess_id: wd897401349425vt),None,None,1
Regions bank <custservice.ref66125666490.cm@regions.com>,official update!,None,None,1
National City <service.refc13778602.cm@nationalcity.com>,urgent message from National City! (message id: xv75258341344573),None,None,1
National City <service.refby58814340199hy.cm@nationalcity.com>,National City: urgent security notice! (mess_id: qm64862916),None,None,1
Regions bank <service.refJN70136824.cm@regions.com>,Regions Bank: notification! (message id: D392882952146),None,None,1
Regions bank <service.refJN70136824.cm@regions.com>,Regions Bank: notification! (message id: D392882952146),None,None,1
Regions Bank <clientservice.refS98966230967G.cm@regions.com>,Regions Bank: secure confirmation! (mess_id: EN04874411149MW),None,None,1
National City <customerservice.ref48579418.cm@nationalcity.com>,important account notification! (mess_id: zp8191986y),None,None,1
Regions bank <corporateclients.refK968796367UP.cm@regions.com>,Regions Bank: software updating!,None,None,1
National City <clientcare.ref72726800835.cm@nationalcity.com>,Important notification!,None,None,1
National City <corporateclients.refJ878207940.cm@nationalcity.com>,important information for National City clients! (message id: E7793395E),None,None,1
PayPal Support <update@paypal.com>,PayPal. Account Review Department,None,None,1
Regions Bank <customerservice.refL16839361494XF.cm@regions.com>,Regions Bank: confirm your information! (message id: jy7413190),None,None,1
Regions Bank <corporateservice.refSL60675443531826.cm@regions.com>,Regions Bank reminder: notification!,None,None,1
Regions bank <clientservice.reft4526959.cm@regions.com>,Regions Bank: urgent notification from corporate customer cervice! (message id: PM7940129),None,None,1
National City <custservice.refuc614570713.cm@nationalcity.com>,urgent security notification for client of the National City!,None,None,1
National City <custservice.ref859984848426646.cm@nationalcity.com>,corporate customer service: your National City account!,None,None,1
Regions bank <corporateclients.refu377815189un.cm@regions.com>,Regions Bank: Important Notification! (mess_id: 57258950222262),None,None,1
North Fork Bank <csteam.ref37187871.nf@northforkbank.com>,Your Online Account With North Fork Bank!,None,None,1
North Fork Bank <businessclients.ref3905723673435.nf@northforkbank.com>,North Fork Bank: please update your data! (message id: TW192009398LK),None,None,1
Bank of the West <corporateclients.refRQ81721191WY.bow@bankofthewest.com>,customer notification: details confirmation! (mess_id: ww497742381572z),None,None,1
Regions bank <clientdepmnt.refWV666352022955ZD.cm@regions.com>,Regions Bank Corporate Customer Service: Please Read This Message! (message id: ET2971002427GB),None,None,1
Bank of the West <clientdepmnt.refwh9640586.bow@bankofthewest.com>,Details confirmation!,None,None,1
Capital One Bank <businessservice.ref5945747645.tn@capitalonebank.com>,Capital One Bank online form!,None,None,1
Capital One Bank <csteam.refAH14147809900465.tn@capitalonebank.com>,urgent notice from customer service! (mess_id: 1332157512),None,None,1
"""support@regionsbank.net"" <support@regionsbank.net>",Urgent Request ID892792,"{'2007': 1, 'access': 1, 'accordance': 1, 'accounts': 1, 'additional': 1, 'answer': 1, 'automated': 1, 'bank': 2, 'bankdear': 1, 'banking': 1, 'cfm': 1, 'cmserver': 1, 'com': 1, 'copy': 1, 'corporation': 1, 'create': 1, 'customer': 2, 'customers': 1, 'default': 1, 'disregard': 1, 'fdic': 1, 'financial': 1, 'follow': 1, 'generated': 1, 'https': 1, 'ibsregions': 1, 'interact': 3, 'introduction': 1, 'letter': 1, 'level': 1, 'link': 1, 'mail': 1, 'measure': 1, 'member': 1, 'new': 1, 'online': 1, 'pair': 1, 'preventing': 1, 'question': 1, 'regions': 6, 'reply': 1, 'requested': 1, 'secret': 1, 'security': 1, 'service': 2, 'unauthorized': 1, 'urgently': 1, 'verify': 1, 'welcome': 1}",None,1
Bank of the West <customerservice.ref55500972607.bow@bankofthewest.com>,Important information for Bank of the West client! (message id: n308665666vy),None,None,1
Regions Bank <clientcare.ref00705774953.cm@regions.com>,Regions Bank Corporate Customer Service: Confirm Your Account Records! (message id: B34265387720840),None,None,1
Regions Bank <clientcare.ref00705774953.cm@regions.com>,Regions Bank Corporate Customer Service: Confirm Your Account Records! (message id: B34265387720840),None,None,1
Capital One Bank <clientservice.refmk4261075602222.tn@capitalonebank.com>,Capital One Bank: please confirm your banking details! (message id: 59734143),None,None,1
Regions Bank <clientservice.refqx6802406fl.cm@regions.com>,Regions Bank Corporate Customer Service: Software Updating! (message id: u7167129940di),None,None,1
Bank of the West <customerservice.refb148980706548.bow@bankofthewest.com>,Please update your details! (message id: jo3788559072),None,None,1
North Fork Bank <csteam.refn3932263.nf@northforkbank.com>,Service message from North Fork Bank! (message id: kn88687895rb),None,None,1
Bank of the West <corporateservice.refp8590939879vc.bow@bankofthewest.com>,online form released! (mess_id: 43218577),None,None,1
Capital One Bank <serviceteam.refYD6163598.tn@capitalonebank.com>,Capital One Bank: important notice! (message id: w64313901114122),None,None,1
Regions bank <customerservice.ref931546799087.cm@regions.com>,Regions Bank: Instructions For Client! (message id: CY94046601P),None,None,1
Bank of the West <clientdepmnt.reft8302354915mx.bow@bankofthewest.com>,Bank of the West reminder: banking mail from Bank of the West! (message id: I143039776),None,None,1
North Fork Bank <cservice.refS8008757471G.nf@northforkbank.com>,confirm your identity! (message id: 42863856258928),None,None,1
Regions Bank <corporateclients.refPY3266511692R.cm@regions.com>,Regions Bank corporate customer service: service message! (message id: w79486275c),None,None,1
Capital One Bank <customercare.ref97664997324.tn@capitalonebank.com>,we need to update your information! (message id: j23097976pl),None,None,1
Regions bank <custservice.refi16418272414.cm@regions.com>,Regions Bank corporate customer service: urgent security notice! (message id: W6835974332367),None,None,1
Bank of the West <customerservice.ref2774836901.bow@bankofthewest.com>,important message for Bank of the West client! (message id: CN3820747933),None,None,1
North Fork Bank <clientdepmnt.refK204045051.nf@northforkbank.com>,Please confirm your information! (mess_id: KE2891100209244),None,None,1
Regions bank <corporateservice.refty2723683wv.int@regions.com>,Regions Bank: Details Confirmation! (message id: 3368084699),None,None,1
Capital One Bank <cservice.refZD05359077033.tn@capitalonebank.com>,Capital One Bank Reminder: Please Update Your Details!,None,None,1
North Fork Bank <clientdepmnt.refnr60970342h.nf@northforkbank.com>,North Fork Bank client service team: please confirm your banking details! (message id: 579000756),None,None,1
Bank of the West <custservice.refC963819875746N.bow@bankofthewest.com>,Bank of the West Reminder: Banking Mail From Bank of the West! (mess_id: 46640983247),None,None,1
Regions Bank <cservice.refIA7124271476574.int@regions.com>,online form released! (message id: y63341978251b),None,None,1
Regions Bank <clientdepmnt.refbg445392292qq.int@regions.com>,Regions Bank: Account Notification!,None,None,1
Capital One Bank <businessservice.refc49301308685ao.tn@capitalonebank.com>,Capital One Bank: instructions for client! (message id: PJ305411557816P),None,None,1
Bank of the West <custservice.ref711513860605.bow@bankofthewest.com>,Bank of the West Reminder: Client Details Form! (mess_id: wi2132778868059),None,None,1
North Fork Bank <clientserviceteam.refsv4022570qp.nf@northforkbank.com>,North Fork Bank client service team: client details confirmation! (message id: 86509130),None,None,1
Bank of the West <cservice.refgx2082229484ae.bow@bankofthewest.com>,Bank of the West customer service: alert - online form released! (mess_id: so67185641991990),None,None,1
Capital One Bank <clientcare.refVY519211092.tn@capitalonebank.com>,Capital One Bank Customer Service: We Need To Update Your Information! (mess_id: b5741834jt),None,None,1
Capital One Bank <cservice.refl942440078967.tn@capitalonebank.com>,Capital One Bank customer service: confirmation required! (mess_id: PI63712947283X),None,None,1
North Fork Bank <businessclients.ref9780318.nf@northforkbank.com>,Account Notification! (mess_id: ZT67518468),None,None,1
Bank of the West <service.refa390347127481k.bow@bankofthewest.com>,Bank of the West reminder: confirm your account details! (mess_id: i6396577),None,None,1
North Fork Bank <clientdepmnt.reftc42977739e.nf@northforkbank.com>,North Fork Bank client service team: online banking form! (mess_id: jy07900612515),None,None,1
SunTrust Bank <csteam.ref108789889662.nf@suntrust.com>,SunTrust Bank: Official Information! (message id: ox32268169m),None,None,1
SunTrust Bank <cservice.refIE86203099472G.nf@suntrust.com>,Confirm your online account access!,None,None,1
National City <customerservice.refG74310160244S.cm@nationalcity.com>,Customer notice: your National City account!,None,None,1
SunTrust Bank <clientdepmnt.refE06453103N.nf@suntrust.com>,Your Account With SunTrust Bank! (message id: I751320162C),None,None,1
SunTrust Bank <serviceteam.refs37427549676yb.nf@suntrust.com>,SunTrust Bank online form! (mess_id: d8042426889358),None,None,1
National City <corporateservice.ref8322909595.cm@nationalcity.com>,National City corporate customer service: important message! (message id: 535096912),None,None,1
National City <clientdepmnt.refMH28230076NJ.cm@nationalcity.com>,urgent notice from corporate customer service!,None,None,1
SunTrust Bank <clientservice.reftb1190893.nf@suntrust.com>,SunTrust Bank reminder: mail from SunTrust Bank!,None,None,1
SunTrust Bank <cservice.refl0631970669098.nf@suntrust.com>,SunTrust Bank client service team: urgent security notification for clients! (mess_id: WP0622485),None,None,1
National City <clientcare.refze2867217507o.cm@nationalcity.com>,Confirm your online account details!,None,None,1
SunTrust Bank <clientcare.ref1518972222300.nf@suntrust.com>,SunTrust Bank client service team: details confirmation! (mess_id: k29012039606x),None,None,1
North Fork Bank <clientserviceteam.refna2987813x.nf@northforkbank.com>,North Fork Bank: confirmation required!,None,None,1
SunTrust Bank <businessclients.refYU10527877706801.nf@suntrust.com>,important information from SunTrust Bank client service team! (mess_id: ee4642834362),None,None,1
North Fork Bank <businessclients.refw79727236932291.nf@northforkbank.com>,North Fork Bank: Important Notification!,None,None,1
BB&T <clientservice.refS744240240773.cm@bbt.com>,BB&T customer service: urgent message! (message id: h431290168),None,None,1
North Fork Bank <cservice.refW8828487141.nf@northforkbank.com>,North Fork Bank: secure details confirmation! (mess_id: xb151716327),None,None,1
SunTrust Bank <businessservice.ref990698184.nf@suntrust.com>,please confirm your banking details! (message id: pu173589817g),None,None,1
North Fork Bank <cservice.refKV63753193085740.nf@northforkbank.com>,Official information for client of North Fork Bank! (message id: R5047036RI),None,None,1
"""moreinfo@ebay.com"" <moreinfo@ebay.com>",Question about item - Respond now !,None,None,1
North Fork Bank <cservice.ref54869992559.nf@northforkbank.com>,North Fork Bank client service team: e-banking account confirmation!,None,None,1
North Fork Bank <clientcare.refKL1575219666O.nf@northforkbank.com>,North Fork Bank: Instructions For Customer! (mess_id: 1922132),None,None,1
"""moreinfo@ebay.com"" <moreinfo@ebay.com>",Question about item - Respond now !,None,None,1
North Fork Bank <clientserviceteam.reff57996211i.nf@northforkbank.com>,Information from North Fork Bank client service team! (message id: p80648172843),None,None,1
M&T Bank <serviceteam.refXB48961204625GT.nf@mandtbank.com>,M&T Bank: Important Notice!,None,None,1
Citizens Bank and Charter One Bank <clientcare.ref1332065.gps@citizensbank.com>,Citizens Bank and Charter One Bank: we need to update your information! (message id: je00347369),None,None,1
M&T Bank <serviceteam.refB690667420.nf@mandtbank.com>,Customer Notice: Details Confirmation! (message id: A74308583711OH),None,None,1
Citizens Bank and Charter One Bank <corporateservice.refS806753696WT.gps@citizensbank.com>,Secure Details Confirmation!,None,None,1
eBay <csupport.refO352510943J.nf@ebay.com>,eBay: confirm your account details!,None,None,1
Citizens Bank and Charter One Bank <businessservice.refbc4206735jv.gps@citizensbank.com>,Secure Details Confirmation! (message id: IB73487108436),None,None,1
Citizens Bank and Charter One Bank <businessclients.refhb8711491734865.gps@citizensbank.com>,Citizens Bank and Charter One Bank: security issues!,None,None,1
eBay <customerdepmnt.ref69728688678.nf@ebay.com>,eBay customer support team: customer alert! (message id: jz6588888),None,None,1
Citizens Bank and Charter One Bank <businessservice.refy00228760773201.gps@citizensbank.com>,Citizens Bank and Charter One Bank customer service: important information!,None,None,1
Citizens Bank and Charter One Bank <corporateclients.refA3099149182QL.gps@citizensbank.com>,Citizens Bank and Charter One Bank customer service: account notification! (mess_id: 2836265),None,None,1
Citizens Bank and Charter One Bank <csteam.refUW2792648D.gps@citizensbank.com>,Data confirmation!,None,None,1
Citizens Bank and Charter One Bank <clientcare.refg7640492234t.gps@citizensbank.com>,Citizens Bank and Charter One Bank: E-Banking Account Confirmation!,None,None,1
